{
  "id": "conference-companion-demo",
  "name": "Conference Companion Demo",
  "shortName": "Conference Demo",
  "fullName": "Conference Companion Generic Demo",
  "startDate": "2027-03-15",
  "endDate": "2027-03-16",
  "timezone": "Europe/London",
  "timezoneLabel": "London time",
  "locale": "en-GB",
  "language": "en",
  "city": "Cambridge",
  "country": "United Kingdom",
  "officialWebsite": "https://example.org",
  "contactEmail": "conference@example.org",
  "mainVenueId": "venue-main",
  "features": {
    "posters": false,
    "photos": true,
    "notes": true,
    "pptxExport": true,
    "friendBook": true,
    "calendarExport": true,
    "announcements": true
  },
  "links": []
}
